title,heading,content,tokens
Chiller,Summary,"A chiller is a machine that removes heat from a liquid coolant via a vapor-compression, adsorption refrigeration, or absorption refrigeration cycles. This liquid can then be circulated through a heat exchanger to cool equipment, or another process stream (such as air or process water). As a necessary by-product, refrigeration creates waste heat that must be exhausted to ambience, or for greater efficiency, recovered for heating purposes. Vapor compression chillers may use any of a number of different types of compressors. Most common today are the hermetic scroll, semi-hermetic screw, or centrifugal compressors. The condensing side of the chiller can be either air or water cooled. Even when liquid cooled, the chiller is often cooled by an induced or forced draft cooling tower. Absorption and adsorption chillers require a heat source to function.Chilled water is used to cool and dehumidify air in mid- to large-size commercial, industrial, and institutional facilities. Water cooled chillers can be liquid-cooled (through cooling towers), air-cooled, or evaporatively cooled. Water or liquid-cooled systems can provide efficiency and environmental impact advantages over air-cooled systems.",258
Chiller,Use in air conditioning,"In air conditioning systems, chilled coolant, usually chilled water mixed with ethylene glycol, from a chiller in an air conditioning or cooling plant is typically distributed to heat exchangers, or coils, in air handlers or other types of terminal devices which cool the air in their respective space(s). The water is then recirculated to the chiller to be recooled. These cooling coils transfer sensible heat and latent heat from the air to the chilled water, thus cooling and usually dehumidifying the air stream. A typical chiller for air conditioning applications is rated between 50 kW (170 thousand BTU/h) and 7 MW (24 million BTU/h), and at least two manufacturers (York international and LG) can produce chillers capable of up to 21 MW (72 million BTU/h) cooling. Chilled water temperatures (leaving from the chiller) usually range from 1 to 7 °C (34 to 45 °F), depending upon application requirements. Commonly, chillers receive water at 12°C (entering temperature), and cool it to 7°C (leaving temperature).When the chillers for air conditioning systems are not operable or they are in need of repair or replacement, emergency chillers may be used to supply chilled water. Rental chillers are mounted on a trailer so that they can be quickly deployed to the site. Large chilled water hoses are used to connect between rental chillers and air conditioning systems.",306
Chiller,Use in industry,"In industrial application, chilled water or other coolant liquid from the chiller is pumped through process or laboratory equipment.  Industrial chillers are used for controlled cooling of products, mechanisms and factory machinery in a wide range of industries.  They are often used in the plastic industries, injection and blow molding, metal working cutting oils, welding equipment, die-casting and machine tooling, chemical processing, pharmaceutical formulation, food and beverage processing, paper and cement processing, vacuum systems, X-ray diffraction, power supplies and gas turbine power generation stations (see Turbine inlet air cooling#Vapour compression chiller), analytical equipment, semiconductors, compressed air and gas cooling. They are also used to cool high-heat specialized items such as MRI machines and lasers, and in hospitals, hotels and campuses.
Chillers for industrial applications can be centralized, where a single chiller serves multiple cooling needs, or decentralized where each application or machine has its own chiller. Each approach has its advantages. It is also possible to have a combination of both centralized and decentralized chillers, especially if the cooling requirements are the same for some applications or points of use, but not all.
Chilled water is used to cool and dehumidify air in mid- to large-size commercial, industrial, and institutional (CII) facilities.  Liquid chillers can be liquid-cooled, air-cooled, or evaporatively cooled. Water or liquid-cooled chillers incorporate the use of cooling towers which improve the chillers' thermodynamic effectiveness as compared to air-cooled chillers. This is due to heat rejection at or near the air's wet-bulb temperature rather than the higher, sometimes much higher, dry-bulb temperature. Evaporatively cooled chillers offer higher efficiencies than air-cooled chillers but lower than liquid-cooled chillers.
Liquid-cooled chillers are typically intended for indoor installation and operation, and are cooled by a separate condenser water loop and connected to outdoor cooling towers to expel heat to the atmosphere.
Air-cooled and evaporative cooled chillers are intended for outdoor installation and operation. Air-cooled machines are directly cooled by ambient air being mechanically circulated directly through the machine's condenser coil to expel heat to the atmosphere. Evaporative cooled machines are similar, except they implement a mist of water over the condenser coil to aid in condenser cooling, making the machine more efficient than a traditional air-cooled machine. No remote cooling tower is typically required with either of these types of packaged air-cooled or evaporatively cooled chillers.
Where available, cold water readily available in nearby water bodies might be used directly for cooling, replace or supplement cooling towers. The deep water source cooling system in Toronto, Ontario, Canada, is an example. It uses cold lake water to cool the chillers, which in turn are used to cool city buildings via a district cooling system. The return water is used to warm the city's drinking water supply, which is desirable in this cold climate. Whenever a chiller's heat rejection can be used for a productive purpose, in addition to the cooling function, very high thermal effectiveness is possible.",665
Chiller,Vapor-compression chiller technology,"A vapor compression chiller typically uses one of four types of compressor: Reciprocating compression, scroll compression, screw-driven compression, and centrifugal compression are all mechanical machines that can be powered by electric motors, steam, or gas turbines. Using electric motors in a semi-hermetic or hermetic configuration is the most common method of driving the compressors since electric motors can be effectively and easily cooled by the refrigerant, without requiring fuel supply or exhaust ventilation and no shaft seals are required as the motor can operate in the refrigerant, reducing maintenance, leaks, operating costs and downtime, although open compressors are sometimes used. They produce their cooling effect via the reverse-Rankine cycle, also known as vapor-compression. With evaporative cooling heat rejection, their coefficients of performance (COPs) are very high; typically 4.0 or more.

COP 
  
    
      
        =
        
          
            Cooling power
            Input power
          
        
      
    
    {\displaystyle ={\frac {\text{Cooling power}}{\text{Input power}}}}
  Current vapor-compression chiller technology is based on the ""reverse-Rankine"" cycle known as vapor-compression.
See the attached diagram which outlines the key components of the chiller system.

Key components of the chiller:
Refrigeration compressors are essentially a pump for refrigerant gas. The capacity of the compressor,
and hence the chiller cooling capacity, is measured in kilowatts input (kW), Horse power input (HP), or
volumetric flow (m3/h, ft3/h). The mechanism for compressing refrigerant gas differs between
compressors, and each has its own application. Common refrigeration compressors include
reciprocating, scroll, screw, or centrifugal. These can be powered by electric motors, steam turbines, or
gas turbines. Compressors can have an integrated motor from a specific manufacturer, or be open drive--allowing the connection to another type of mechanical connection. Compressors can also be either
Hermetic (welded closed) or semihermetic (bolted together).
In recent years, application of variable-speed drive (VSD) technology has increased efficiencies of vapor
compression chillers. The first VSD was applied to centrifugal compressor chillers in the late 1970s and
has become the norm as the cost of energy has increased. Now, VSDs are being applied to rotary screw
and scroll-technology compressors.
Condensers can be air-cooled, liquid-cooled, or evaporative. The condenser is a heat exchanger which
allows heat to migrate from the refrigerant gas to either water or air. Air cooled condenser are
manufactured from copper tubes (for the refrigerant flow) and aluminium fins (for the air flow). Each
condenser has a different material cost and they vary in terms of efficiency. With evaporative cooling
condensers, their coefficients-of-performance (COPs) are very high; typically 4.0 or more. Air cooled condensers are installed and operated outdoors and are cooled with outside air, that is often forced through the condenser using electric fans. Water or liquid cooled condensers are cooled with water that is often in turn cooled by a cooling tower.
The expansion device or refrigerant metering device (RMD) restricts the flow of the liquid refrigerant
causing a pressure drop that vaporizes some of the refrigerant; this vaporization absorbs heat from nearby liquid refrigerant.
The RMD is located immediately prior to the evaporator so that the cold gas in the evaporator can absorb
heat from the water in the evaporator. There is a sensor for the RMD on the evaporator outlet side which
allows the RMD to regulate the refrigerant flow based on the chiller design requirement.
Evaporators can be plate type or shell and tube type. The evaporator is a heat exchanger which allows
the heat energy to migrate from the water stream into the refrigerant gas. During the state change of the remaining
liquid to gas, the refrigerant can absorb large amounts of heat without changing temperature.",974
Chiller,How absorption technology works,"The thermodynamic cycle of an absorption chiller is driven by a heat source; this heat is usually delivered to the chiller via steam, hot water, or combustion. Compared to electrically powered chillers, an absorption chiller has very low electrical power requirements – very rarely above 15 kW combined consumption for both the solution pump and the refrigerant pump.  However, its heat input requirements are large, and its COP is often 0.5 (single-effect) to 1.0 (double-effect). For the same cooling capacity, an absorption chiller requires a much larger cooling tower than a vapor-compression chiller.  However, absorption chillers, from an energy-efficiency point of view, excel where cheap, low-grade heat or waste heat is readily available.  In extremely sunny climates, solar energy has been used to operate absorption chillers.
The single-effect absorption cycle uses water as the refrigerant and lithium bromide as the absorbent. It is the strong affinity that these two substances have for one another that makes the cycle work. The entire process occurs in almost a complete vacuum.

Solution Pump : A dilute lithium bromide solution (60% concentration) is collected in the bottom of the absorber shell. From here, a hermetic solution pump moves the solution through a shell and tube heat exchanger for preheating.
Generator : After exiting the heat exchanger, the dilute solution moves into the upper shell. The solution surrounds a bundle of tubes which carries either steam or hot water. The steam or hot water transfers heat into the pool of dilute lithium bromide solution. The solution boils, sending refrigerant vapor upward into the condenser and leaving behind concentrated lithium bromide. The concentrated lithium bromide solution moves down to the heat exchanger, where it is cooled by the weak solution being pumped up to the generator.
Condenser : The refrigerant vapor migrates through mist eliminators to the condenser tube bundle. The refrigerant vapor condenses on the tubes. The heat is removed by the cooling water which moves through the inside of the tubes. As the refrigerant condenses, it collects in a trough at the bottom of the condenser.
Evaporator : The refrigerant liquid moves from the condenser in the upper shell down to the evaporator in the lower shell and is sprayed over the evaporator tube bundle. Due to the extreme vacuum of the lower shell [6 mm Hg (0.8 kPa) absolute pressure], the refrigerant liquid boils at approximately 39 °F (4 °C), creating the refrigerant effect. (This vacuum is created by hygroscopic action – the strong affinity lithium bromide has for water – in the Absorber directly below.)
Absorber : As the refrigerant vapor migrates to the absorber from the evaporator, the strong lithium bromide solution from the generator is sprayed over the top of the absorber tube bundle. The strong lithium bromide solution actually pulls the refrigerant vapor into solution, creating the extreme vacuum in the evaporator. The absorption of the refrigerant vapor into the lithium bromide solution also generates heat which is removed by the cooling water.  Now the dilute lithium bromide solution collects in the bottom of the lower shell, where it flows down to the solution pump. The chilling cycle is now completed and the process begins once again.",709
Chiller,Industrial chiller technology,"Industrial chillers typically come as complete, packaged, closed-loop systems, including the chiller unit, condenser, and pump station with recirculating pump, expansion valve, no-flow shutdown, internal cold water control. The internal tank helps maintain cold water temperature and prevents temperature spikes from occurring. Closed-loop industrial chillers recirculate a clean coolant or clean water with condition additives at a constant temperature and pressure to increase the stability and reproducibility of water-cooled machines and instruments. The water flows from the chiller to the application's point of use and back.If the water temperature differentials between inlet and outlet are high, then a large external water tank would be used to store the cold water. In this case the chilled water is not going directly from the chiller to the application, but goes to the external water tank which acts as a sort of ""temperature buffer."" The cold water tank is much larger than the internal water goes from the external tank to the application and the return hot water from the application goes back to the external tank, not to the chiller.The less common open loop industrial chillers control the temperature of a liquid in an open tank or sump by constantly recirculating it. The liquid is drawn from the tank, pumped through the chiller and back to the tank. In industrial water chillers is the use of water cooling instead of air cooling. In this case the condenser does not cool the hot refrigerant with ambient air, but uses water that is cooled by a cooling tower. This development allows a reduction in energy requirements by more than 15% and also allows a significant reduction in the size of the chiller, due to the small surface area of the water-based condenser and the absence of fans. Additionally, the absence of fans allows for significantly reduced noise levels.Most industrial chillers use refrigeration as the media for cooling, but some rely on simpler techniques such as air or water flowing over coils containing the coolant to regulate temperature.  Water is the most commonly used coolant within process chillers, although coolant mixtures (mostly water with a coolant additive to enhance heat dissipation) are frequently employed.",453
Chiller,Industrial chiller selection,"Important specifications to consider when searching for industrial chillers include the total life cycle cost, the power source, chiller IP rating, chiller cooling capacity, evaporator capacity, evaporator material, evaporator type, condenser material, condenser capacity, ambient temperature, motor fan type, noise level, internal piping materials, number of compressors, type of compressor, number of fridge circuits, coolant requirements, fluid discharge temperature, and COP (the ratio between the cooling capacity in RT to the energy consumed by the whole chiller in kW). For medium to large chillers this should range from 3.5 to 7.0, with higher values meaning higher efficiency. In the US, chiller efficiency is often specified in kilowatts per refrigeration ton (kW/RT).
Process pump specifications that are important to consider include the process flow, process pressure, pump material, elastomer and mechanical shaft seal material, motor voltage, motor electrical class, motor IP rating and pump rating. If the cold water temperature is lower than −5 °C, then a special pump needs to be used to be able to pump the high concentrations of ethylene glycol. Other important specifications include the internal water tank size and materials and full load current.
Control panel features that should be considered when selecting between industrial chillers include the local control panel, remote control panel, fault indicators, temperature indicators, and pressure indicators.
Additional features include emergency alarms, hot gas bypass, city water switchover, and casters.Demountable chillers are also an option for deployment in remote areas and where the conditions may be hot and dusty.If noise levels of the chiller are acoustically unacceptable, noise control engineers will implement sound attenuators to reduce chiller noise levels. Larger chillers will typically require an array of sound attenuators sometimes known as a silencer bank.",387
Chiller,Refrigerants,"A vapor-compression chiller uses a refrigerant internally as its working fluid.  Many refrigerants options are available; when selecting a chiller, the application cooling temperature requirements and refrigerant's cooling characteristics need to be matched.  Important parameters to consider are the operating temperatures and pressures.
There are several environmental factors that concern refrigerants, and also affect the future availability for chiller applications.  This is a key consideration in intermittent applications where a large chiller may last for 25 years or more. Ozone depletion potential (ODP) and global warming potential (GWP) of the refrigerant need to be considered. ODP and GWP data for some of the more common vapor-compression refrigerants (noting that many of these refrigerants are highly flammable and/or toxic):
R12 is the ODP reference.  CO2 is the GWP reference
The refrigerants used in the chillers sold in Europe are mainly R410a (70%), R407c (20%) and R134a (10%).",218
Energy recovery ventilation,Summary,"Energy recovery ventilation (ERV) is the energy recovery process in residential and commercial HVAC systems that exchanges the energy contained in normally exhausted air of a building or conditioned space, using it to treat (precondition) the incoming outdoor ventilation air. The specific equipment involved may be called an Energy Recovery Ventilator, also abbreviated ERV.
During the warmer seasons, an ERV system pre-cools and dehumidifies; During cooler seasons the system humidifies and pre-heats.  An ERV system helps HVAC design meet ventilation and energy standards (e.g., ASHRAE), improves indoor air quality and reduces total HVAC equipment capacity, thereby reducing energy consumption.
ERV systems enable an HVAC system to maintain a 40-50% indoor relative humidity, essentially in all conditions.  ERV's must use power for a blower to overcome the pressure drop in the system, hence incurring a slight energy demand.",204
Energy recovery ventilation,Importance,"Nearly half of global energy is used in buildings, and half of heating/cooling cost is caused by ventilation when it is done by the ""open window"" method according to the regulations. Secondly, energy generation and grid is made to meet the peak demand of power. To use proper ventilation; recovery is a cost-efficient, sustainable and quick way to reduce global energy consumption and give better indoor air quality (IAQ) and protect buildings, and environment.",95
Energy recovery ventilation,Methods of transfer,"An ERV is a type of air-to-air heat exchanger that transfers sensible heat as well as latent heat. Because both temperature and moisture are transferred, ERVs are described as total enthalpic devices.  In contrast, a heat recovery ventilator (HRV) can only transfer sensible heat. HRVs can be considered sensible only devices because they only exchange sensible heat.  In other words, all ERVs are HRVs, but not all HRVs are ERVs. It is incorrect to use the terms HRV, AAHX (air-to-air heat exchanger), and ERV interchangeably.During the cooling season, the system works to cool and dehumidify the incoming, outside air. To do this, the system takes the rejected heat and sends it into the exhaust airstream.  Subsequently, this air cools the condenser coil at a lower temperature than if the rejected heat had not entered the exhaust airstream.  During the heating seasons, the system works in reverse.  Instead of discharging the heat into the exhaust airstream, the system draws heat from the exhaust airstream in order to pre-heat the incoming air.  At this stage, the air passes through a primary unit and then into the space being conditioned.  With this type of system, it is normal during the cooling seasons for the exhaust air to be cooler than the ventilation air and, during the heating seasons, warmer than the ventilation air.  It is for this reason the system works efficiently and effectively. The coefficient of performance (COP) will increase as the conditions become more extreme (i.e., more hot and humid for cooling and colder for heating).",349
Energy recovery ventilation,Efficiency,"The efficiency of an ERV system is the ratio of energy transferred between the two air streams compared with the total energy transported through the heat exchanger.With the variety of products on the market, efficiency will vary as well.  Some of these systems have been known to have heat exchange efficiencies as high as 70-80% while others have as low as 50%.  Even though this lower figure is preferable to the basic HVAC system, it is not up to par with the rest of its class.  Studies are being done to increase the heat transfer efficiency to 90%.The use of modern low-cost gas-phase heat exchanger technology will allow for significant improvements in efficiency.  The use of high conductivity porous material is believed to produce an exchange effectiveness in excess of 90%.  By exceeding a 90% effective rate, an improvement of up to five factors in energy loss can be seen.The Home Ventilating Institute (HVI) has developed a standard test for any and all units manufactured within the United States.  Regardless, not all have been tested.  It is imperative to investigate efficiency claims, comparing data produced by HVI as well as that produced by the manufacturer. (Note: all units sold in Canada are placed through the R-2000 program, a standard test synonymous to the HVI test).",272
Energy recovery ventilation,Rotary air-to-air enthalpy wheel,"The rotating wheel heat exchanger is a rotating cylinder filled with an air permeable material, typically polymer, aluminum, or synthetic fiber, providing the large surface area required for the sensible enthalpy transfer. (Enthalpy is a measure of heat.) As the wheel rotates between the supply and exhaust air streams it picks up heat energy and releases it into the colder air stream. The driving force behind the exchange is the difference in temperatures between the opposing air streams (the thermal gradient).
The enthalpy exchange is accomplished through the use of desiccants.  Desiccants transfer moisture through the process of adsorption which is predominately driven by the difference in the partial pressure of vapor within the opposing air-streams.  Typical desiccants consist of silica gel, and molecular sieves.
Enthalpy wheels are the most effective devices to transfer both latent and sensible heat energy. Choice of construction materials for the rotor, most commonly polymer, aluminum, or fiberglass, determines durability.
When using rotary energy recovery devices the two air streams must be adjacent to one another to allow for the local transfer of energy.  Also, there should be special considerations paid in colder climates to avoid wheel frosting. Systems can avoid frosting by modulating wheel speed, preheating the air, or stop/jogging the system.",286
