title,heading,content,tokens
Ammonium hydrosulfide,Composition,"It is the salt derived from the ammonium cation and the hydrosulfide anion. The salt exists as colourless, water-soluble, micaceous crystals. On Earth the compound is encountered mainly as a solution, not as the solid, but [NH4]SH ice is believed to be a substantial component of the cloud decks of the gas-giant planets Jupiter and Saturn, with sulfur produced by its photolysis responsible for the color of some of those planets' clouds. It can be generated by mixing hydrogen sulfide and ammonia.",116
Ammonium hydrosulfide,Preparation,"Solutions of ammonium hydrosulfide can be prepared by passing hydrogen sulfide gas through concentrated ammonia solution. According to a detailed 1895 report, hydrogen sulfide reacts with concentrated aqueous ammonia solution at room temperature to give [NH4]2S·2[NH4]SH. When this species is cooled to 0 °C and treated with additional hydrogen sulfide, one obtains [NH4]2S·12[NH4]SH. An ice-cold solution of this substance kept at 0 °C and having hydrogen sulfide continually passed through it gives the hydrosulfide.
The common ""stink bomb"" consists of an aqueous solution of ammonium sulfide. The mixture easily converts to ammonia and hydrogen sulfide gases. This conversion illustrates the ease of the following equilibrium:

[NH4]SH ⇌ NH3 + H2SAmmonia and hydrogen sulfide each have a powerful and unpleasant smell.",199
Ammonium hydrosulfide,"""Ammonium sulfide""","Aqueous solutions of ammonium sulfide (CAS registry number 12135-76-1 ), also known as diammonium sulfide are commercially available, although the composition of these solutions is uncertain as they could consist of a mixture of ammonia and [NH4]SH. Ammonium sulfide solutions are used occasionally in photographic developing, to apply patina to bronze, and in textile manufacturing. It can be used as a selective reducing agent (cf. 2,4-dinitrochlorobenzene); where there are two nitro groups, only one of them is selectively reduced.
The 1990-1991 CRC Handbook of Chemistry and Physics gives information for anhydrous ammonium monosulfide ([NH4]2S) and ammonium pentasulfide ([NH4]2S5) as separate from anhydrous ammonium hydrosulfide ([NH4]SH), describing the former two both as yellow crystalline substances that are soluble in cold water and alcohol, and which both decompose in hot water or at high temperature in general (115°C for the pentasulfide), but the latter as a white crystalline solid (which also decomposes in hot water). Thus, it seems that solid ammonium sulfide can be distinct from solid ammonium hydrosulfide, even if this is not true in aqueous solution.",284
Disulfur diiodide,Summary,Disulfur diiodide is an unstable chemical compound with the formula S2I2. It is a red-brown solid that decomposes above -30 °C to elemental sulfur and iodine.,44
Disulfur diiodide,Reaction of sulfur and iodine,"The first attempt and claim to produce a sulfur iodide were made in 1813 by Bernard Courtois when exploring the properties of his newly discovered element, iodine. He reacted to sulfur and iodine, claiming they had made a compound. However, this production was doubted by Gay-Lussac. Between 1827 and 1896, more attempts were made to make sulfur iodide by combining the elements; however, all were inconclusive on the existence of the compound or failed. Later, when thermal analysis was developed, it was shown that when the elements were combined, it only resulted in a mixture, not a compound.",130
Disulfur diiodide,Production by double replacement,"When attempts to produce sulfur iodide by the direct combination of the elements failed to overcome the low thermodynamic stability of the compound, production by double replacement was attempted between 1833 and 1886. Some reactions that were attempted was the reaction of disulfur dichloride and hydroiodic acid:
(S2)Cl2 + 2HI → (S2)I2 + 2HClThe reaction of hydrogen sulfide and iodine trichloride:

3H2S + 2ICl3 → (S3)I2 + 6HClThe reaction of hydroiodic acid and sulfur:

2HI + 3S → H2S + (S2)I2The reaction of disulfur dichloride and potassium iodide:

(S2)Cl2 + 2KI → (S2)I2 + 2KCland more, all assumed to have failed to produce sulfur iodide. However, the reaction between S2Cl2 and HI attempted in 1835 was later proven to have produced disulfur diiodide.In 1940, another production was attempted with the fourth reaction and was reported to have detected various sulfur iodides, such as disulfur diiodide and sulfur diiodide(SI2). When observing the reaction of very dilute disulfur dichloride in carbon tetrachloride and potassium iodide:
S2Cl2 + 2 KI → 2S + I2 + 2KClthey observed a color change from yellow to reddish-brown to finally violet, which was assumed to be evidence for the formation of sulfur iodides. The compound was found to decompose at room temperature slowly in a solution, with the decomposition rate increasing with increasing temperature.",364
Disulfur diiodide,Isolation,"Disulfur diiodide was first isolated by the reaction of disulfur dichloride and potassium iodide, sodium iodide, or hydrogen iodide in pentane at -90 °C, and verified by infrared spectroscopy.",52
Disulfur diiodide,Other sulfur iodides,"Sulfur diiodide(SI2) has finally been reported in an argon matrix at 9 K by the reaction of sulfur dichloride and iodine; however, this has been disputed.Sulfur and iodine react in antimony pentafluoride or arsenic trifluoride to form the S7I+ ion, which is stable at room temperature, unlike other sulfur-iodine compounds.",91
Amyl alcohol,Summary,"An amyl alcohol is any of eight alcohols with the formula C5H12O. A mixture of amyl alcohols (also called amyl alcohol) can be obtained from fusel alcohol. Amyl alcohol is used as a solvent and in esterification, by which is produced amyl acetate and other important products. The name amyl alcohol without further specification applies to the normal (straight-chain) form, 1-pentanol.These are the 8 alcohols that are structural isomers with molecular formula C5H12O:

Three of these alcohols, 2-methyl-1-butanol, 2-pentanol, and 3-methyl-2-butanol (methyl isopropyl carbinol), are therefore optically active.
The most important amyl alcohol is isoamyl alcohol, the chief one generated by fermentation in the production of alcoholic beverages and a constituent of fusel oil. The other amyl alcohols may be obtained synthetically.",208
Thiamylal,Summary,"Thiamylal (Surital) is a barbiturate derivative invented in the 1950s. It has sedative, anticonvulsant, and hypnotic effects, and is used as a strong but short acting sedative. Thiamylal is still in current use, primarily for induction in surgical anaesthesia or as an anticonvulsant to counteract side effects from other anaesthetics. It is the thiobarbiturate analogue of secobarbital.",102
Sesamin,Summary,"Sesamin is a lignan isolated from the bark of Fagara plants and from sesame oil. It has been used as a dietary fat-reduction supplement. Its major metabolite is enterolactone, which has an elimination half life of less than 6 hours. Sesamin and sesamolin are minor components of sesame oil, on average comprising only 0.14% of the oil by mass.",91
Secoisolariciresinol diglucoside,Summary,"Secoisolariciresinol diglucoside (SDG)  is an antioxidant phytoestrogen present in flax, sunflower, sesame, and pumpkin seeds. In food, it can be found in commercial breads containing flaxseed.  It is a precursor of mammal lignans  which are produced in the colon from chemicals in foods.",82
Secoisolariciresinol diglucoside,Extraction,"Secoisolariciresinol diglucoside can be isolated from de-fatted (hexane extraction) flaxseed by extraction of the lignan polymer precursor with a water/acetone mixture, followed by acetone removal and alkaline hydrolysis.",60
Secoisolariciresinol diglucoside,Studies on biological effects,"Secoisolariciresinol diglucoside slows the growth of human breast cancer in mice.Secoisolariciresinol diglucoside may different roles in people. For example, due to 400-500Da size limit for Blood–Brain Barrier permeability, in one assessment of a Grade IV histology group of adult patients diagnosed with malignant glioma, high intake of secoisolariciresinol (for highest tertile compared to lowest tertile, in all cases) was associated with poorer survival.In rabbits, SDG reduced hypercholesterolemic atherosclerosis and this effect was associated with a decrease in serum cholesterol, LDL-C, and lipid peroxidation product and an increase in HDL-C and antioxidant reserve.SDG has been shown to counter oxidative stress in human colonic epithelial tissue and protect against mtDNA damage in vitro, by H2O2 exposure, in a dose-dependent manner, and counters (in-vitro) oxidative stress on heart cells caused by Iron overload.",221
Breast,Summary,"The breast is one of two prominences located on the upper ventral region of a primate's torso. Both females and males develop breasts from the same embryological tissues.
In females, it serves as the mammary gland, which produces and secretes milk to feed infants. Subcutaneous fat covers and envelops a network of ducts that converge on the nipple, and these tissues give the breast its size and shape. At the ends of the ducts are lobules, or clusters of alveoli, where milk is produced and stored in response to hormonal signals. During pregnancy, the breast responds to a complex interaction of hormones, including estrogens, progesterone, and prolactin, that mediate the completion of its development, namely lobuloalveolar maturation, in preparation of lactation and breastfeeding.
Humans are the only animals with permanent breasts. At puberty, estrogens, in conjunction with growth hormone, cause permanent breast growth in female humans. This happens only to a much lesser extent in other primates—breast development in other primates generally only occurs with pregnancy. Along with their major function in providing nutrition for infants, female breasts have social and sexual characteristics. Breasts have been featured in ancient and modern sculpture, art, and photography. They can figure prominently in the perception of a woman's body and sexual attractiveness. A number of cultures associate breasts with sexuality and tend to regard bare breasts in public as immodest or indecent. Breasts, especially the nipples, are an erogenous zone.",316
Breast,Etymology and terminology,"The English word breast derives from the Old English word brēost ('breast, bosom') from Proto-Germanic *breustam (breast), from the Proto-Indo-European base bhreus– (to swell, to sprout). The breast spelling conforms to the Scottish and North English dialectal pronunciations. The Merriam-Webster Dictionary states that ""Middle English brest, [comes] from Old English brēost; akin to Old High German brust..., Old Irish brú [belly], [and] Russian bryukho""; the first known usage of the term was before the 12th century.A large number of colloquial terms for breasts are used in English, ranging from fairly polite terms to vulgar or slang. Some vulgar slang expressions may be considered to be derogatory or sexist to women.",182
Breast,Evolutionary development,"Humans are the only mammals whose breasts become permanently enlarged after sexual maturity (known in humans as puberty). The reason for this evolutionary change was unknown. Several hypotheses have been put forward:
A link has been proposed to processes for synthesizing the endogenous steroid hormone precursor dehydroepiandrosterone which takes place in fat rich  regions  of the body like the buttocks and breasts. These contributed to human brain development and played a part in increasing brain size.  Breast enlargement may for this purpose may have occurred as early as Homo ergaster (1.7–1.4 MYA). Other breast formation hypotheses may have then taken over as principal drivers.It has been suggested by zoologists Avishag and Amotz Zahavi  that the size of the human  breasts can be explained by the handicap theory of sexual dimorphism. This would see the explanation for larger breasts as them being  an honest display of the women's health and ability to grow and carry them in her life. Prospective mates can then evaluate the genes of a potential mate for their ability to sustain her health even with the additional energy demanding burden she is carrying.The zoologist Desmond Morris describes a sociobiological approach in his popular science book The Naked Ape. He suggests, by making comparisons with the other primates, that breasts evolved to replace swelling buttocks as a sex signal, of ovulation. He notes how humans have, relatively speaking, large penises as well as large breasts. Furthermore, early humans adopted bipedalism and face-to-face coitus. He therefore suggested enlarged sexual signals helped maintain the bond between a mated male and female even though they performed different duties and therefore were separated for lengths of time.The study The Evolution of the Human Breast (2001) proposed that the rounded shape of a woman's breast evolved to prevent the sucking infant offspring from suffocating while feeding at the teat; that is, because of the human infant's small jaw, which did not project from the face to reach the nipple, he or she might block the nostrils against the mother's breast if it were of a flatter form (cf. common chimpanzee). Theoretically, as the human jaw receded into the face, the woman's body compensated with round breasts.Ashley Montague (1965) proposed that breasts came about as an  adaptation for infant feeding for a different reason as early human ancestors adopted bipedalism and the loss of body hair.  Human upright stance meant  infants must be carried at the hip or shoulder instead of on the back as in the apes. This gives the infant less opportunity to find the nipple or the  purchase to cling on to the mother's body hair.  The mobility of the nipple on a large breast  in most human females gives the infant more ability to find grasp it and feed.Other suggestions include simply that permanent breasts attracted mates, that ""pendulous"" breasts gave infants something to cling to, or that permanent breasts shared the function of a camel's hump, to store fat as an energy reserve.",626
Breast,Anatomy,"In women, the breasts overlie the pectoralis major muscles and extend on average from the level of the second rib to the level of the sixth rib in the front of the rib cage; thus, the breasts cover much of the chest area and the chest walls. At the front of the chest, the breast tissue can extend from the clavicle (collarbone) to the middle of the sternum (breastbone). At the sides of the chest, the breast tissue can extend into the axilla (armpit), and can reach as far to the back as the latissimus dorsi muscle, extending from the lower back to the humerus bone (the bone of the upper arm). As a mammary gland, the breast is composed of differing layers of tissue, predominantly two types: adipose tissue; and glandular tissue, which affects the lactation functions of the breasts.: 115 Morphologically the breast is tear-shaped. The superficial tissue layer (superficial fascia) is separated from the skin by 0.5–2.5 cm of subcutaneous fat (adipose tissue). The suspensory Cooper's ligaments are fibrous-tissue prolongations that radiate from the superficial fascia to the skin envelope. The female adult breast contains 14–18 irregular lactiferous lobes that converge at the nipple. The 2.0–4.5 mm milk ducts are immediately surrounded with dense connective tissue that support the glands. Milk exits the breast through the nipple, which is surrounded by a pigmented area of skin called the areola. The size of the areola can vary widely among women. The areola contains modified sweat glands known as Montgomery's glands. These glands secrete oily fluid that lubricate and protect the nipple during breastfeeding. Volatile compounds in these secretions may also serve as an olfactory stimulus for the newborn's appetite.The dimensions and weight of the breast vary widely among women. A small-to-medium-sized breast weighs 500 grams (1.1 pounds) or less, and a large breast can weigh approximately 750 to 1,000 grams (1.7 to 2.2 pounds) or more. The tissue composition ratios of the breast also vary among women. Some women's breasts have a higher proportion of glandular tissue than of adipose or connective tissues. The fat-to-connective-tissue ratio determines the density or firmness of the breast. During a woman's life, her breasts change size, shape, and weight due to hormonal changes during puberty, the menstrual cycle, pregnancy, breastfeeding, and menopause.",545
Breast,Glandular structure,"The breast is an apocrine gland that produces the milk used to feed an infant. The nipple of the breast is surrounded by the areola (nipple-areola complex). The areola has many sebaceous glands, and the skin color varies from pink to dark brown. The basic units of the breast are the terminal duct lobular units (TDLUs), which produce the fatty breast milk. They give the breast its offspring-feeding functions as a mammary gland. They are distributed throughout the body of the breast. Approximately two-thirds of the lactiferous tissue is within 30 mm of the base of the nipple. The terminal lactiferous ducts drain the milk from TDLUs into 4–18 lactiferous ducts, which drain to the nipple. The milk-glands-to-fat ratio is 2:1 in a lactating woman, and 1:1 in a non-lactating woman. In addition to the milk glands, the breast is also composed of connective tissues (collagen, elastin), white fat, and the suspensory Cooper's ligaments. Sensation in the breast is provided by the peripheral nervous system innervation by means of the front (anterior) and side (lateral) cutaneous branches of the fourth-, fifth-, and sixth intercostal nerves. The T-4 nerve (Thoracic spinal nerve 4), which innervates the dermatomic area, supplies sensation to the nipple-areola complex.",308
Breast,Lymphatic drainage,"Approximately 75% of the lymph from the breast travels to the axillary lymph nodes on the same side of the body, whilst 25% of the lymph travels to the parasternal nodes (beside the sternum bone).: 116  A small amount of remaining lymph travels to the other breast and to the abdominal lymph nodes. The subareolar region has a lymphatic plexus known as the ""subareolar plexus of Sappey"". The axillary lymph nodes include the pectoral (chest), subscapular (under the scapula), and humeral (humerus-bone area) lymph-node groups, which drain to the central axillary lymph nodes and to the apical axillary lymph nodes. The lymphatic drainage of the breasts is especially relevant to oncology because breast cancer is common to the mammary gland, and cancer cells can metastasize (break away) from a tumour and be dispersed to other parts of the body by means of the lymphatic system.",213
Breast,"Shape, texture, and support","The morphologic variations in the size, shape, volume, tissue density, pectoral locale, and spacing of the breasts determine their natural shape, appearance, and position on a woman's chest. Breast size and other characteristics do not predict the fat-to-milk-gland ratio or the potential for the woman to nurse an infant. The size and the shape of the breasts are influenced by normal-life hormonal changes (thelarche, menstruation, pregnancy, menopause) and medical conditions (e.g. virginal breast hypertrophy). The shape of the breasts is naturally determined by the support of the suspensory Cooper's ligaments, the underlying muscle and bone structures of the chest, and by the skin envelope. The suspensory ligaments sustain the breast from the clavicle (collarbone) and the clavico-pectoral fascia (collarbone and chest) by traversing and encompassing the fat and milk-gland tissues. The breast is positioned, affixed to, and supported upon the chest wall, while its shape is established and maintained by the skin envelope. In most women, one breast is slightly larger than the other. More obvious and persistent asymmetry in breast size occurs in up to 25% of women.While it is a common belief that breastfeeding causes breasts to sag, researchers have found that a woman's breasts sag due to four key factors: cigarette smoking, number of pregnancies, gravity, and weight loss or gain.The base of each breast is attached to the chest by the deep fascia over the pectoralis major muscles. The space between the breast and the pectoralis major muscle, called retromammary space, gives mobility to the breast. 
The chest (thoracic cavity) progressively slopes outwards from the thoracic inlet (atop the breastbone) and above to the lowest ribs that support the breasts. The inframammary fold, where the lower portion of the breast meets the chest, is an anatomic feature created by the adherence of the breast skin and the underlying connective tissues of the chest; the IMF is the lower-most extent of the anatomic breast. Normal breast tissue typically has a texture that feels nodular or granular, to an extent that varies considerably from woman to woman.",482
Breast,Development,"The breasts are principally composed of adipose, glandular, and connective tissues. Because these tissues have hormone receptors, their sizes and volumes fluctuate according to the hormonal changes particular to thelarche (sprouting of breasts), menstruation (egg production), pregnancy (reproduction), lactation (feeding of offspring), and menopause (end of menstruation).",77
Breast,Puberty,"The morphological structure of the human breast is identical in males and females until puberty. For pubescent girls in thelarche (the breast-development stage), the female sex hormones (principally estrogens) in conjunction with growth hormone promote the sprouting, growth, and development of the breasts. During this time, the mammary glands grow in size and volume and begin resting on the chest. These development stages of secondary sex characteristics (breasts, pubic hair, etc.) are illustrated in the five-stage Tanner Scale.During thelarche the developing breasts are sometimes of unequal size, and usually the left breast is slightly larger. This condition of asymmetry is transitory and statistically normal in female physical and sexual development. Medical conditions can cause overdevelopment (e.g., virginal breast hypertrophy, macromastia) or underdevelopment (e.g., tuberous breast deformity, micromastia) in girls and women.
Approximately two years after the onset of puberty (a girl's first menstrual cycle), estrogen and growth hormone stimulate the development and growth of the glandular fat and suspensory tissues that compose the breast. This continues for approximately four years until the final shape of the breast (size, volume, density) is established at about the age of 21. Mammoplasia (breast enlargement) in girls begins at puberty, unlike all other primates in which breasts enlarge only during lactation.",299
Breast,Pregnancy and breastfeeding,"The breasts reach full maturity only when a woman's first pregnancy occurs.  Changes to the breasts are among the first signs of pregnancy. The breasts become larger, the nipple-areola complex becomes larger and darker, the Montgomery's glands enlarge, and veins sometimes become more visible. Breast tenderness during pregnancy is common, especially during the first trimester. By mid-pregnancy, the breast is physiologically capable of lactation and some women can express colostrum, a form of breast milk.Pregnancy causes elevated levels of the hormone prolactin, which has a key role in the production of milk. However, milk production is blocked by the hormones progesterone and estrogen until after delivery, when progesterone and estrogen levels plummet.",155
Breast,Menopause,"At menopause, breast atrophy occurs. The breasts can decrease in size when the levels of circulating estrogen decline. The adipose tissue and milk glands also begin to wither. The breasts can also become enlarged from adverse side effects of combined oral contraceptive pills. The size of the breasts can also increase and decrease in response to weight fluctuations. Physical changes to the breasts are often recorded in the stretch marks of the skin envelope; they can serve as historical indicators of the increments and the decrements of the size and volume of a woman's breasts throughout the course of her life.",119
Breast,Breastfeeding,"The primary function of the breasts, as mammary glands, is the nourishing of an infant with breast milk. Milk is produced in milk-secreting cells in the alveoli. When the breasts are stimulated by the suckling of her baby, the mother's brain secretes oxytocin. High levels of oxytocin trigger the contraction of muscle cells surrounding the alveoli, causing milk to flow along the ducts that connect the alveoli to the nipple.Full-term newborns have an instinct and a need to suck on a nipple, and breastfed babies nurse for both nutrition and for comfort.  Breast milk provides all necessary nutrients for the first six months of life, and then remains an important source of nutrition, alongside solid foods, until at least one or two years of age.",168
Breast,Clinical significance,"The breast is susceptible to numerous benign and malignant conditions. The most frequent benign conditions are puerperal mastitis, fibrocystic breast changes and mastalgia.
Lactation unrelated to pregnancy is known as galactorrhea. It can be caused by certain drugs (such as antipsychotic medications), extreme physical stress, or endocrine disorders. Lactation in newborns is caused by hormones from the mother that crossed into the baby's bloodstream during pregnancy.",100
