title,heading,content,tokens
Acetylene,Safety and handling,"Acetylene is not especially toxic, but when generated from calcium carbide, it can contain toxic impurities such as traces of phosphine and arsine, which give it a distinct garlic-like smell. It is also highly flammable, as are most light hydrocarbons, hence its use in welding. Its most singular hazard is associated with its intrinsic instability, especially when it is pressurized: under certain conditions acetylene can react in an exothermic addition-type reaction to form a number of products, typically benzene and/or vinylacetylene, possibly in addition to carbon and hydrogen. Consequently, acetylene, if initiated by intense heat or a shockwave, can decompose explosively if the absolute pressure of the gas exceeds about 200 kilopascals (29 psi). Most regulators and pressure gauges on equipment report gauge pressure, and the safe limit for acetylene therefore is 101 kPagage, or 15 psig. It is therefore supplied and stored dissolved in acetone or dimethylformamide (DMF), contained in a gas cylinder with a porous filling (Agamassan), which renders it safe to transport and use, given proper handling. Acetylene cylinders should be used in the upright position to avoid withdrawing acetone during use.Information on safe storage of acetylene in upright cylinders is provided by the OSHA, Compressed Gas Association, United States Mine Safety and Health Administration (MSHA), EIGA, and other agencies.
Copper catalyses the decomposition of acetylene, and as a result acetylene should not be transported in copper pipes.Cylinders should be stored in an area segregated from oxidizers to avoid exacerbated reaction in case of fire/leakage. Acetylene cylinders should not be stored in confined spaces, enclosed vehicles, garages, and buildings, to avoid unintended leakage leading to explosive atmosphere. In the US, National Electric Code (NEC) requires consideration for hazardous areas including those where acetylene may be released during accidents or leaks. Consideration may include electrical classification and use of listed Group A electrical components in USA. Further information on determining the areas requiring special consideration is in NFPA 497. In Europe, ATEX also requires consideration for hazardous areas where flammable gases may be released during accidents or leaks.",473
Potato Research,Summary,"Potato Research: Journal of the European Association for Potato Research is a quarterly peer-reviewed scientific journal covering all aspects of the production and use of potatoes. It was established in 1958 as the European Potato Journal, obtaining its current name in 1970. It is published by Springer Science+Business Media on behalf of the European Association for Potato Research. The editor-in-chief is Paul C. Struik (Wageningen University).",91
Wayback Machine,Summary,"The Wayback Machine is a digital archive of the World Wide Web founded by the Internet Archive, a nonprofit based in San Francisco, California. Created in 1996 and launched to the public in 2001, it allows the user to go ""back in time"" and see how websites looked in the past. Its founders, Brewster Kahle and Bruce Gilliat, developed the Wayback Machine to provide ""universal access to all knowledge"" by preserving archived copies of defunct web pages.Launched on May 10, 1996, the Wayback Machine had more than 38.2 million records at the end of 2009. As of November 2022, the Wayback Machine had saved more than 780 billion web pages. More than 350 million web pages are added daily.",152
Wayback Machine,History,"The Wayback Machine began archiving cached web pages in 1996. One of the earliest known pages was saved on May 10, 1996, at 2:08 p.m.Internet Archive founders Brewster Kahle and Bruce Gilliat launched the Wayback Machine in San Francisco, California, in October 2001, primarily to address the problem of web content vanishing whenever it gets changed or when a website is shut down. The service enables users to see archived versions of web pages across time, which the archive calls a ""three-dimensional index"". Kahle and Gilliat created the machine hoping to archive the entire Internet and provide ""universal access to all knowledge"". The name ""Wayback Machine"" is a reference to a fictional time-traveling and translation device, the ""Wayback Machine"", used by the characters Mister Peabody and Sherman in the animated cartoon The Adventures of Rocky and Bullwinkle and Friends. In one of the cartoon's segments, ""Peabody's Improbable History"", the characters used the machine to witness, participate in, and often alter famous events in history.
From 1996 to 2001, the information was kept on digital tape, with Kahle occasionally allowing researchers and scientists to tap into the ""clunky"" database. When the archive reached its fifth anniversary in 2001, it was unveiled and opened to the public in a ceremony at the University of California, Berkeley. By the time the Wayback Machine launched, it already contained over 10 billion archived pages. The data is stored on the Internet Archive's large cluster of Linux nodes. It revisits and archives new versions of websites on occasion (see technical details below). Sites can also be captured manually by entering a website's URL into the search box, provided that the website allows the Wayback Machine to ""crawl"" it and save the data.On October 30, 2020, the Wayback Machine began fact-checking content. As of January 2022, domains of ad servers are disabled from capturing.For Internet Archive's 25th anniversary, the Wayback Machine introduced the ""Wayforward Machine"" which allowed users to ""travel to the Internet in 2046, where knowledge is under siege"".",437
Wayback Machine,Technical information,"Software has been developed to ""crawl"" the Web and download all publicly accessible information and data files on webpages, the Gopher hierarchy, the Netnews (Usenet) bulletin board system, and downloadable software. The information collected by these ""crawlers"" does not include all the information available on the Internet, since much of the data is restricted by the publisher or stored in databases that are not accessible. To overcome inconsistencies in partially cached websites, Archive-It.org was developed in 2005 by the Internet Archive as a means of allowing institutions and content creators to voluntarily harvest and preserve collections of digital content, and create digital archives.Crawls are contributed from various sources, some imported from third parties and others generated internally by the Archive. For example, crawls are contributed by the Sloan Foundation and Alexa, crawls run by Internet Archive on behalf of NARA and the Internet Memory Foundation, mirrors of Common Crawl. The ""Worldwide Web Crawls"" have been running since 2010 and capture the global Web.Documents and resources are stored with time stamp URLs such as 20230114233200. Pages' individual resources such as images and style sheets and scripts, as well as outgoing hyperlinks, are linked to with the time stamp of the currently viewed page, so they are redirected automatically to their individual captures that are the closest in time.The frequency of snapshot captures varies per website. Websites in the ""Worldwide Web Crawls"" are included in a ""crawl list"", with the site archived once per crawl. A crawl can take months or even years to complete, depending on size. For example, ""Wide Crawl Number 13"" started on January 9, 2015, and completed on July 11, 2016. However, there may be multiple crawls ongoing at any one time, and a site might be included in more than one crawl list, so how often a site is crawled varies widely.Starting in October 2019, users are limited to 15 archival requests and retrievals per minute.",412
Wayback Machine,Storage capacity and growth,"As technology has developed over the years, the storage capacity of the Wayback Machine has grown. In 2003, after only two years of public access, the Wayback Machine was growing at a rate of 12 terabytes per month. The data is stored on PetaBox rack systems custom designed by Internet Archive staff. The first 100TB rack became fully operational in June 2004, although it soon became clear that they would need much more storage than that.The Internet Archive migrated its customized storage architecture to Sun Open Storage in 2009, and hosts a new data centre in a Sun Modular Datacenter on Sun Microsystems' California campus. As of 2009, the Wayback Machine contained approximately three petabytes of data and was growing at a rate of 100 terabytes each month.A new, improved version of the Wayback Machine, with an updated interface and a fresher index of archived content, was made available for public testing in 2011, where captures appear in a calendar layout with circles whose width visualizes the number of crawls each day, but no marking of duplicates with asterisks or an advanced search page. A top toolbar has been added to facilitate navigating between captures. A bar chart visualizes the frequency of captures per month over the years. Features like ""Changes"", ""Summary"", and a graphical site map were added subsequently.
In March that year, it was said on the Wayback Machine forum that ""the Beta of the new Wayback Machine has a more complete and up-to-date index of all crawled materials into 2010, and will continue to be updated regularly. The index driving the classic Wayback Machine only has a little bit of material past 2008, and no further index updates are planned, as it will be phased out this year."" Also in 2011, the Internet Archive installed their sixth pair of PetaBox racks which increased the Wayback Machine's storage capacity by 700 terabytes.In January 2013, the company announced a ground-breaking milestone of 240 billion URLs.In October 2013, the company introduced the ""Save a Page"" feature which allows any Internet user to archive the contents of a URL, and quickly generates a permanent link unlike the preceding liveweb feature.
In December 2014, the Wayback Machine contained 435 billion web pages—almost nine petabytes of data, and was growing at about 20 terabytes a week.In March 2015, it was published that security researchers became aware of the threat posed by the service's unintentional hosting of malicious binaries from archived sites.In July 2016, the Wayback Machine reportedly contained around 15 petabytes of data.In September 2018, the Wayback Machine contained over 25 petabytes of data.As of December 2020, the Wayback Machine contained over 70 petabytes of data.
Between October 2013 and March 2015, the website's global Alexa rank changed from 163 to 208. In March 2019 the rank was at 244.",588
Wayback Machine,Wayback Machine APIs,"The Wayback Machine service offers three public APIs, SavePageNow, Availability, and CDX. SavePageNow can be used to archive web pages. Availability API for checking the archive availability status for a web page, checking whether an archive for the web page exists or not. CDX API is for complex querying, filtering, and analysis of captured data.",77
Wayback Machine,Website exclusion policy,"Historically, the Wayback Machine has respected the robots exclusion standard (robots.txt) in determining if a website would be crawled – or if already crawled, if its archives would be publicly viewable. Website owners had the option to opt-out of Wayback Machine through the use of robots.txt. It applied robots.txt rules retroactively; if a site blocked the Internet Archive, any previously archived pages from the domain were immediately rendered unavailable as well. In addition, the Internet Archive stated that ""Sometimes, a website owner will contact us directly and ask us to stop crawling or archiving a site. We comply with these requests."" In addition, the website says: ""The Internet Archive is not interested in preserving or offering access to Web sites or other internet documents of persons who do not want their materials in the collection.""On April 17, 2017, reports surfaced of sites that had gone defunct and became parked domains that were using robots.txt to exclude themselves from search engines, resulting in them being inadvertently excluded from the Wayback Machine. The Internet Archive changed the policy to now require an explicit exclusion request to remove it from the Wayback Machine.",238
Wayback Machine,Oakland Archive Policy,"Wayback's retroactive exclusion policy is based in part upon Recommendations for Managing Removal Requests and Preserving Archival Integrity published by the School of Information Management and Systems at University of California, Berkeley in 2002, which gives a website owner the right to block access to the site's archives.  Wayback has complied with this policy to help avoid expensive litigation.The Wayback retroactive exclusion policy began to relax in 2017, when it stopped honoring robots on U.S. government and military web sites for both crawling and displaying web pages. As of April 2017, Wayback is ignoring robots.txt more broadly, not just for U.S. government websites.",139
Wayback Machine,Uses,"From its public launch in 2001, the Wayback Machine has been studied by scholars both for the ways it stores and collects data as well as for the actual pages contained in its archive. As of 2013, scholars had written about 350 articles on the Wayback Machine, mostly from the information technology, library science, and social science fields. Social science scholars have used the Wayback Machine to analyze how the development of websites from the mid-1990s to the present has affected the company's growth.When the Wayback Machine archives a page, it usually includes most of the hyperlinks, keeping those links active when they just as easily could have been broken by the Internet's instability. Researchers in India studied the effectiveness of the Wayback Machine's ability to save hyperlinks in online scholarly publications and found that it saved slightly more than half of them.""Journalists use the Wayback Machine to view dead websites, dated news reports, and changes to website contents. Its content has been used to hold politicians accountable and expose battlefield lies."" In 2014, an archived social media page of Igor Girkin, a separatist rebel leader in Ukraine, showed him boasting about his troops having shot down a suspected Ukrainian military airplane before it became known that the plane actually was a civilian Malaysian Airlines jet (Malaysia Airlines Flight 17), after which he deleted the post and blamed Ukraine's military for downing the plane. In 2017, the March for Science originated from a discussion on Reddit that indicated someone had visited Archive.org and discovered that all references to climate change had been deleted from the White House website. In response, a user commented, ""There needs to be a Scientists' March on Washington"".Furthermore, the site is used heavily for verification, providing access to references and content creation by Wikipedia editors.In September 2020, a partnership was announced with Cloudflare to automatically archive websites served via its ""Always Online"" service, which will also allow it to direct users to its copy of the site if it cannot reach the original host.",406
Wayback Machine,Limitations,"In 2014 there was a six-month lag time between when a website was crawled and when it became available for viewing in the Wayback Machine. Currently, the lag time is 3 to 10 hours. The Wayback Machine offers only limited search facilities. Its ""Site Search"" feature allows users to find a site based on words describing the site, rather than words found on the web pages themselves.The Wayback Machine does not include every web page ever made due to the limitations of its web crawler. The Wayback Machine cannot completely archive web pages that contain interactive features such as Flash platforms and forms written in JavaScript and progressive web applications, because those functions require interaction with the host website. This means that, since approximately July 9, 2013, the Wayback Machine has been unable to display YouTube comments when saving videos' watch pages, as, according to the Archive Team, comments are no longer ""loaded within the page itself."" The Wayback Machine's web crawler has difficulty extracting anything not coded in HTML or one of its variants, which can often result in broken hyperlinks and missing images. Due to this, the web crawler cannot archive ""orphan pages"" that are not linked to by other pages. The Wayback Machine's crawler only follows a predetermined number of hyperlinks based on a preset depth limit, so it cannot archive every hyperlink on every page.",280
Wayback Machine,Netbula LLC v. Chordiant Software Inc.,"In a 2009 case, Netbula, LLC v. Chordiant Software Inc., defendant Chordiant filed a motion to compel Netbula to disable the robots.txt file on its website that was causing the Wayback Machine to retroactively remove access to previous versions of pages it had archived from Netbula's site, pages that Chordiant believed would support its case.Netbula objected to the motion on the ground that defendants were asking to alter Netbula's website and that they should have subpoenaed Internet Archive for the pages directly. An employee of Internet Archive filed a sworn statement supporting Chordiant's motion, however, stating that it could not produce the web pages by any other means ""without considerable burden, expense and disruption to its operations.""Magistrate Judge Howard Lloyd in the Northern District of California, San Jose Division, rejected Netbula's arguments and ordered them to disable the robots.txt blockage temporarily in order to allow Chordiant to retrieve the archived pages that they sought.",217
Wayback Machine,"Telewizja Polska USA, Inc. v. Echostar Satellite","In an October 2004 case, Telewizja Polska USA, Inc. v. Echostar Satellite, No. 02 C 3293, 65 Fed. R. Evid. Serv. 673 (N.D. Ill. October 15, 2004), a litigant attempted to use the Wayback Machine archives as a source of admissible evidence, perhaps for the first time. Telewizja Polska is the provider of TVP Polonia and EchoStar operates the Dish Network. Prior to the trial proceedings, EchoStar indicated that it intended to offer Wayback Machine snapshots as proof of the past content of Telewizja Polska's website. Telewizja Polska brought a motion in limine to suppress the snapshots on the grounds of hearsay and unauthenticated source, but Magistrate Judge Arlander Keys rejected Telewizja Polska's assertion of hearsay and denied TVP's motion in limine to exclude the evidence at trial. At the trial, however, District Court Judge Ronald Guzman, the trial judge, overruled Magistrate Keys' findings, and held that neither the affidavit of the Internet Archive employee nor the underlying pages (i.e., the Telewizja Polska website) were admissible as evidence. Judge Guzman reasoned that the employee's affidavit contained both hearsay and inconclusive supporting statements, and the purported web page, printouts were not self-authenticating.",316
Wayback Machine,Patent law,"Provided some additional requirements are met (e.g., providing an authoritative statement of the archivist), the United States patent office and the European Patent Office will accept date stamps from the Internet Archive as evidence of when a given Web page was accessible to the public. These dates are used to determine if a Web page is available as prior art for instance in examining a patent application.",79
Wayback Machine,Limitations of utility,"There are technical limitations to archiving a website, and as a consequence, opposing parties in litigation can misuse the results provided by website archives. This problem can be exacerbated by the practice of submitting screenshots of web pages in complaints, answers, or expert witness reports when the underlying links are not exposed and therefore, can contain errors. For example, archives such as the Wayback Machine do not fill out forms and therefore, do not include the contents of non-RESTful e-commerce databases in their archives.",106
Wayback Machine,Legal status,"In Europe, the Wayback Machine could be interpreted as violating copyright laws. Only the content creator can decide where their content is published or duplicated, so the Archive would have to delete pages from its system upon request of the creator. The exclusion policies for the Wayback Machine may be found in the FAQ section of the site.Some cases have been brought against the Internet Archive specifically for its Wayback Machine archiving efforts.",88
Wayback Machine,Scientology,"In late 2002, the Internet Archive removed various sites that were critical of Scientology from the Wayback Machine. An error message stated that this was in response to a ""request by the site owner"". Later, it was clarified that lawyers from the Church of Scientology had demanded the removal and that the site owners did not want their material removed.",70
Wayback Machine,"Healthcare Advocates, Inc.","In 2003, Harding Earley Follmer & Frailey defended a client from a trademark dispute using the Archive's Wayback Machine. The attorneys were able to demonstrate that the claims made by the plaintiff were invalid, based on the content of their website from several years prior. The plaintiff, Healthcare Advocates, then amended their complaint to include the Internet Archive, accusing the organization of copyright infringement as well as violations of the DMCA and the Computer Fraud and Abuse Act. Healthcare Advocates claimed that, since they had installed a robots.txt file on their website, even if after the initial lawsuit was filed, the Archive should have removed all previous copies of the plaintiff website from the Wayback Machine, however, some material continued to be publicly visible on Wayback. The lawsuit was settled out of court after Wayback fixed the problem.",173
Wayback Machine,Suzanne Shell,"Activist Suzanne Shell filed suit in December 2005, demanding Internet Archive pay her US$100,000 for archiving her website profane-justice.org between 1999 and 2004. Internet Archive filed a declaratory judgment action in the United States District Court for the Northern District of California on January 20, 2006, seeking a judicial determination that Internet Archive did not violate Shell's copyright. Shell responded and brought a countersuit against Internet Archive for archiving her site, which she alleges is in violation of her terms of service. On February 13, 2007, a judge for the United States District Court for the District of Colorado dismissed all counterclaims except breach of contract. The Internet Archive did not move to dismiss copyright infringement claims Shell asserted arising out of its copying activities, which would also go forward.On April 25, 2007, Internet Archive and Suzanne Shell jointly announced the settlement of their lawsuit. The Internet Archive said it ""...has no interest in including materials in the Wayback Machine of persons who do not wish to have their Web content archived. We recognize that Ms. Shell has a valid and enforceable copyright in her Web site and we regret that the inclusion of her Web site in the Wayback Machine resulted in this litigation."" Shell said, ""I respect the historical value of Internet Archive's goal. I never intended to interfere with that goal nor cause it any harm.""",278
Wayback Machine,Daniel Davydiuk,"Between 2013 and 2016, a pornographic actor named Daniel Davydiuk tried to remove archived images of himself from the Wayback Machine's archive, first by sending multiple DMCA requests to the archive, and then by appealing to the Federal Court of Canada. The images were then finally removed from the website in 2017.",65
Wayback Machine,FlexiSpy,"In 2018, archives of stalkerware application FlexiSpy's website were removed from the Wayback Machine. The company claimed to have contacted the Internet Archive, presumably to remove the archives of its website.",45
